{
  "schema_version": "1.0.0",
  "fixture_id": "sealed-lighthouse-canonical-v1",
  "scenario_resource": "res://data/sealed_lighthouse.json",
  "run_id": "godot-headless-canonical-v1",
  "episode_id": "sealed-lighthouse-episode-001",
  "seed": 23,
  "fault_mode": "none",
  "expected": {
    "oracle_id": "python-independent-sealed-lighthouse-v1",
    "research_oracle_state_hash": "4b2310173dc059071fdc98e7705608d383dda81559706c3dd33bc96983108892",
    "terminal_state_hash": "4b2310173dc059071fdc98e7705608d383dda81559706c3dd33bc96983108892",
    "fallback_codes": [
      "FORBIDDEN_DISCLOSURE",
      "STAGE_GATED_DISCLOSURE"
    ],
    "committed_operations": [
      "acquire_object",
      "install_lens",
      "reveal_hint"
    ],
    "duplicate_event_count": 0,
    "timeout_count": 0,
    "replay_matches": true,
    "save_load_matches": true
  }
}
